Hotel,Summary
usa_new york city_the_maritime_hotel,"Many rooms have views of the Hudson River from large porthole-shaped windows, with higher floors offering better views. The hotel also provides bicycles and is near the Highline Park."
usa_new york city_the_mark,"The Mark is located on the Upper East Side, near Central Park. Some rooms overlook the inner courtyard, offering a quieter environment."
usa_new york city_the_marmara_manhattan_luxury_hotel_residence,"The Marmara Manhattan offers city views from higher floors, with some suites featuring balconies and windows facing multiple directions. Some rooms offer views of the Empire State Building, East River, and New Jersey."
usa_new york city_the_mave,"I am sorry, but none of the reviews mention that The Mave hotel is located in a scenic retreat. The reviews mention that it is well-located to discover Midtown to Central Park."
usa_new york city_the_mercer_hotel,The Mercer has courtyard rooms with bamboo plantings; some rooms have views of Mercer and Spring street. The hotel is located in a neighborhood with few high-rises.
usa_new york city_the_michelangelo_hotel,"The Michelangelo Hotel is centrally located near Times Square, Central Park, and Broadway, with large, clean rooms. Some rooms have city views, while interior rooms are quieter but lack a view."
usa_new york city_the_milburn_hotel,"I am sorry, but this query is not applicable to the document. These hotel reviews do not make note of the hotel's scenic retreat capabilities."
usa_new york city_the_muse_hotel_new_york_a_kimpton_hotel,The Muse Hotel is centrally located near Times Square and offers upper floor rooms with balconies that overlook midtown Manhattan. Some rooms have views of a church.
usa_new york city_the_new_york_helmsley,"The New York Helmsley offers rooms with nice views, including the Chrysler Building, Empire State Building and East River, with upper floors providing better views; however, some rooms experience noise from street traffic. The hotel is within walking distance of attractions like Grand Central Station and Times Square."
usa_new york city_the_new_yorker_hotel,"Rooms on the 34th floor offer incredible views of Manhattan, including the Empire State Building, Chrysler building and Hudson River. Some rooms have city or Hudson views, or views of Madison Square Garden."
usa_new york city_the_pierre,"The Pierre is located across from Central Park, offering convenient access and views. Some rooms have park views."
usa_new york city_the_plaza,"The hotel is located at the south end of Central Park on 5th Ave, offering proximity to the park and high-end 5th Avenue stores. Some rooms, like the Edwardian Suite, were advertised to have ""sweeping views"" of Central Park, though some rooms had obstructed views of the park or overlooked the internal courtyard."
usa_new york city_the_pod_hotel,"The Pod Hotel has a roof terrace with city skyline views and a garden patio. Some rooms offer decent views, and the hotel is within walking distance of Central Park."
usa_new york city_the_premier,"The Premier offers views of the Chrysler Building, the Paramount Clock, and Times Square from some rooms on higher floors. Some rooms lack views."
usa_new york city_the_ritz_carlton_new_york_central_park,"The Ritz Carlton Central Park offers park view rooms with views of Central Park, with some rooms having telescopes. It's located across the street from Central Park, providing access to the park's scenery."
usa_new york city_the_roosevelt_hotel,The Roosevelt Hotel offers rooftop bar access with panoramic city views. Some rooms on the higher floors may have nice views but are subject to city and traffic noise.
usa_new york city_the_sherry_netherland_hotel,"The Sherry-Netherland offers suites with expansive views of Central Park and the city, some including binoculars and telescopes. Its location on 5th Avenue provides easy access to Central Park, and some rooms offer Empire State Building views."
usa_new york city_the_shoreham,"The Shoreham Hotel's rooms have no views, with some overlooking an air shaft or another building. The Penthouse room includes a balcony, but it does not overlook anything worth seeing."
usa_new york city_the_st_regis_hotel_new_york,"Some rooms offer views of Central Park from the living room, while top-floor rooms have good views up and down the grand streets, though windows may be small. Rooms on the rear side of the building may have less appealing views of a back courtyard with brick buildings."
usa_new york city_the_standard_new_york,"The Standard Hotel in NYC offers rooms with floor-to-ceiling windows that provide views of the Hudson River, Empire State Building, Statue of Liberty, and the High Line. Some rooms have peek-a-boo showers and large bathtubs with views, with higher floors offering better experiences."
usa_new york city_the_surrey,"The Surrey is located on the Upper East Side, near Central Park, offering views of the city and being close to museums. Some rooms overlook Central Park."
usa_new york city_the_sylvan_guest_house,"Sylvan Guest House is located in the historical neighborhood of Harlem, near the Jumel Mansion, the oldest house in Manhattan. It features uniquely designed apartments with African art decorations and a terrace, offering a peaceful environment."
usa_new york city_the_time,"The Time Hotel is located in the heart of the Theater District, just off Times Square, but rooms may not offer views and some look onto exterior walls or brick walls. Some rooms on higher floors are reported to be quiet."
usa_new york city_the_waldorf_astoria,"The Waldorf Astoria offers city views from rooms on higher floors with some overlooking Park Avenue and the Chrysler Building. However, some rooms have views of rooftops or are located near elevator shafts and can be noisy."
usa_new york city_the_westin_new_york_at_times_square,"The Westin New York at Times Square offers rooms with partial views of the Hudson River, corner rooms with views of the Hudson River and the Empire State Building, and rooms on higher floors with panoramic city views. Some rooms have Hudson River views from the bathroom, as well."
usa_new york city_thirty_thirty_hotel,"This hotel is located in Midtown Manhattan, within walking distance of the Empire State Building and near subway stations, but far enough away from Times Square for a quieter atmosphere. Some rooms offer views of the Empire State Building."
usa_new york city_thompson_les,The Thompson LES offers rooms with floor-to-ceiling windows that provide great views of the Lower East Side and Manhattan skyline. Some rooms have balconies with views of landmarks like the Empire State Building and Brooklyn Bridge.
usa_new york city_travel_inn_hotel_new_york,"This hotel has rooms with pool views and is near the Hudson River, marina, and waterfront. Rooms opening onto the pool area may be quiet but a little dark, while rooms overlooking the street may be brighter but slightly noisier."
usa_new york city_tribeca_grand_hotel,"The Tribeca Grand is located in a convenient area within walking distance to Soho, Chinatown and Little Italy. Some rooms have nice views of the streets below so you can people watch."
usa_new york city_trump_international_hotel_and_tower,"The Trump International Hotel and Tower boasts a prime location overlooking Central Park, with many rooms offering spectacular views through floor-to-ceiling windows; some suites also offer views of Columbus Circle and Broadway. The hotel's proximity to the park provides opportunities for scenic walks and a tranquil escape."
usa_new york city_tudor_hotel_at_the_united_nations,"The Tudor Hotel offers rooms with views of the East River, the United Nations, and Tudor City gardens, with some rooms featuring a terrace. The hotel is located near quiet parks with views down to the East River."
usa_new york city_vincci_avalon,"The Avalon Vincci is centrally located near the Empire State Building, allowing views of the building from some rooms, with convenient access to shopping and subway lines. The rooms are generally spacious for New York standards, though some have reported outdated furnishings and temperature control issues."
usa_new york city_w_new_york_the_court,Some rooms have views of the Chrysler Building or the Empire State Building. Rooms on the 12th floor have balconies that overlook 39th Ave.
usa_new york city_w_new_york_the_tuscany,Some rooms at the W Tuscany offer views of the Chrysler Building or the Empire State Building. The hotel is located on a quiet side street and is near Grand Central Station.
usa_new york city_w_new_york_times_square,"The W Times Square offers corner rooms on high floors with views over Times Square, the Hudson River, and Central Park. Rooms with great views are in high demand, but some rooms have obstructed views."
usa_new york city_w_new_york_union_square,"High floors at the W Union Square have fantastic views of NYC, especially south and east-facing rooms. Some rooms offer a view of Union Square."
usa_new york city_waldorf_towers,"The Waldorf Towers is located in Midtown Manhattan and many rooms have views of the Chrysler Building, Park Avenue, or the East River. Some suites feature large windows."
usa_new york city_wall_street_inn,"The Wall Street Inn is located in the Financial District, near the Staten Island Ferry and Battery Park, offering views of Manhattan. It's described as a quiet location, especially on weekends."
usa_new york city_warwick_new_york_hotel,"The Warwick Hotel offers rooms with views of 6th Avenue and Central Park, with some suites featuring balconies and terraces, including a wrap-around terrace in the ""Hollywood Suite"". Some rooms offer city views from higher floors."
usa_new york city_washington_jefferson_hotel,"This hotel is located near Times Square and Central Park, but there are no views from the rooms. Some rooms overlook an interior courtyard or a brick wall."
usa_new york city_washington_square_hotel,"Rooms in the Washington Square Hotel offer views of Washington Square Park and the Empire State Building. Certain rooms face the street and MacDougall, while interior rooms offer quiet."
usa_new york city_wellington_hotel,"The Wellington Hotel is centrally located, with some rooms offering views of Central Park or Times Square from higher floors. Some suites feature balconies and kitchenettes."
usa_new york city_west_57th_street_by_hilton_club,"The hotel is located near Central Park, and some rooms offer views of both the Upper East and West Sides and all of Central Park. The 25th floor has an outside terrace with night light views."
usa_new york city_wingate_by_wyndham_manhattan_midtown,"This hotel is located in midtown Manhattan, with some rooms having views of adjacent buildings. Some higher floor rooms facing the street may have city views, but are subject to noise."
usa_new york city_wolcott_hotel,"I am sorry, I cannot provide information about the hotel being a scenic retreat, as the reviews focus on location, value, and cleanliness, with mentions of nearby attractions like the Empire State Building, but not scenic qualities. Some rooms offer views of the Empire State Building, which is located nearby."
usa_new york city_woogo_central_park,"Some rooms on the upper floors have skyline views and huge rooftop terraces. The hotel is near Central Park, the Dakota building, and Strawberry Fields."
usa_new york city_wyndham_garden_hotel_times_square_south,"Some rooms have a decent view of neighboring buildings and a glimpse of the Hudson River, while upper floor rooms may have a door to a small terrace. The 10th floor has an outdoor terrace bar."
