Hotel,Summary
usa_new york city_3_west_club,The 3 West Club offers views of St. Patrick's Cathedral and Radio City Music Hall. Its location near Rockefeller Center and other attractions is noted.
usa_new york city_414_hotel,"The hotel has a charming leafy patio with mosaic tables and a small interior courtyard that attracts birds, allowing guests to open their windows and hear birdsong. Some rooms overlook the courtyard, and guests can breakfast on the back patio."
usa_new york city_60_thompson,"The hotel has a rooftop bar with views of Manhattan, Wall Street, and the Empire State Building. The rooms on the 11th floor afford great views over SoHo."
usa_new york city_6_columbus,"6 Columbus is located near Central Park and some rooms, especially suites, have views of the park. The hotel has a rooftop terrace that is sometimes closed."
usa_new york city_70_park_avenue_hotel_a_kimpton_hotel,Some rooms at 70 Park Avenue offer views of the Empire State Building. Rooms on higher floors may offer better views and less street noise.
usa_new york city_ace_hotel_nyc,"I am sorry, but this hotel is located in Midtown Manhattan and the reviews do not mention any scenic views, or features that would make it suitable for a scenic retreat."
usa_new york city_affinia_50,"Rooms on higher floors offer great views, and some suites include balconies. Some rooms are reported to be noisy due to street traffic."
usa_new york city_affinia_dumont,"The Affinia Dumont offers rooms with high-floor views, particularly of the Chrysler Building and East River, and is within walking distance to attractions like the Empire State Building. It is located in the Murray Hill neighborhood."
usa_new york city_affinia_gardens,"The Affinia Gardens has garden-facing rooms and some suites feature balconies or patios; it is located on the Upper East Side, a few blocks from Central Park. Some rooms offer park views, but rooms facing the street may have views of the hospital across the street."
usa_new york city_affinia_manhattan,The hotel rooms on the upper floors have views of the Empire State Building and downtown Manhattan. Some rooms offer balconies with city views.
usa_new york city_affinia_shelburne,"The hotel offers views of the Empire State and Chrysler Buildings from some rooms and the rooftop bar, which provides spectacular city views. Some suites have balconies."
usa_new york city_aka_united_nations,"AKA United Nations offers modern apartments with balconies. Some rooms may face construction or office buildings, potentially affecting views and light."
usa_new york city_algonquin_hotel,"The Algonquin Hotel is centrally located, near Times Square and Broadway, but some rooms have views of construction or air shafts. It is a historic hotel with clean, small rooms and comfortable beds, but can be noisy."
usa_new york city_americana_inn,"I am sorry, but none of the reviews mention that Americana Inn is a scenic retreat. Instead, they highlight its budget-friendly nature, central location in Midtown Manhattan, and proximity to attractions like Times Square and the Empire State Building."
usa_new york city_amsterdam_court_hotel,"I am sorry, but this hotel is not a good fit for a scenic retreat. There is not enough information available to provide a summary about its suitability for a scenic retreat. Most reviews mention the small size of the rooms, cleanliness, and excellent location in the Theater District. Some reviews mention views of brick walls or air shafts."
usa_new york city_astor_on_the_park,"The Astor on the Park is located across from Central Park, with some rooms offering views of the park and the Manhattan skyline. The hotel is located on the upper west side of NYC and is near subway lines."
usa_new york city_bedford_hotel,"Rooms on higher floors offer views of the Empire State Building, and some have balconies. One reviewer enjoyed a view of the East River from a top floor room."
usa_new york city_beekman_tower_hotel,"The Beekman Tower has a restaurant on the 26th floor with beautiful views, with some rooms also offering great views and terraces depending on the floor. The Top of the Tower restaurant has views of the East River and the New York skyline."
usa_new york city_belleclaire_hotel,"The Belleclaire Hotel is located on the Upper West Side, near Central Park and the Hudson River, with some rooms offering views of the Hudson River and Broadway. Some higher-floor rooms in the ""turrets"" offer excellent views."
usa_new york city_bentley_hotel,"The Bentley Hotel offers great views of the East River, the 59th Street Bridge, and the Manhattan skyline from its rooms and rooftop bar; deluxe rooms and suites on higher floors provide the best vantage points. The hotel is located on the far east side, near the East River."
usa_new york city_best_western_bowery_hanbee_hotel,"I am sorry, but there does not appear to be information about scenic retreats within these hotel reviews."
usa_new york city_best_western_convention_center_hotel,"This hotel is located in an industrial area and is not known for scenic views, but some rooms on higher floors offer views of the Hudson River; some rooms face a dirty tar roof and train tracks. The surrounding area includes taxi repair garages, a horse barn, and construction sites."
usa_new york city_best_western_hospitality_house,"This hotel is not particularly suited for a scenic retreat, as many reviews mention street noise and views of fire escapes. Some higher floor rooms may offer views of surrounding buildings."
usa_new york city_best_western_seaport_inn_downtown,"The Seaport Inn offers great views of the Brooklyn Bridge from some rooms, particularly terrace rooms and rooms on higher floors. The hotel is located near the Seaport and some rooms also offer harbor views."
usa_new york city_blue_moon_hotel,"The Blue Moon Hotel offers rooms with views of the Williamsburg Bridge, East River, and Empire State Building from the higher floors, including a Penthouse Suite with sweeping city views. Select rooms feature balconies and terraces for enjoying the scenery."
usa_new york city_broadway_plaza_hotel,Some rooms at the Broadway Plaza Hotel offer views of the Empire State Building. The hotel is located a block from the subway and within walking distance of the Empire State Building.
usa_new york city_buckingham_hotel,"Many rooms offer spectacular views up 6th Avenue and 57th Street, and the hotel is near Central Park. Some rooms on higher floors may have city views."
usa_new york city_candlewood_suites_new_york_city_times_square,The hotel is located on the 31st floor and offers a great view of the Empire State Building and the Hudson River. Some rooms have views of a building under construction.
usa_new york city_carlton_arms,"I am sorry, but this hotel summary does not contain details about scenic retreats, so I cannot generate a response."
usa_new york city_carvi_hotel_new_york,"The hotel has rooms at the back facing another building, with some rooms having a glass wall looking onto the space between buildings. There may be building air conditioning noise, and people can look directly into the room if the night shades are open."
usa_new york city_casablanca_hotel,There is no information about scenic views or retreats in the provided hotel reviews for the Casablanca Hotel. The hotel is near Times Square.
usa_new york city_chambers_hotel,"The Chambers Hotel is located off 5th Avenue, near Central Park. Some rooms have views of office buildings."
usa_new york city_chelsea_lodge,"Chelsea Lodge Suites has garden suites with access to a private garden. Some rooms have views of a verdant, private garden with a tree."
usa_new york city_chelsea_pines_inn,"Chelsea Pines Inn's rooms on the upper floors overlook the garden, and some rooms have a pleasant view of a courtyard. Its location is near the Hudson River Park, Chelsea Piers, and the High Line park overlooking the Hudson."
usa_new york city_chelsea_savoy_hotel,"The hotel has rooms with views, particularly those overlooking 7th Avenue. It is located in Chelsea, within walking distance of Times Square, Madison Square Garden, and the Empire State Building."
usa_new york city_city_club_hotel,"Many rooms have poor views, some facing brick walls, though some higher-floor rooms have balconies overlooking 44th Street. Some rooms have city views of 44th street."
usa_new york city_clarion_collection_the_solita_soho_hotel,"The hotel is located in lower Manhattan, with some rooms offering views of the Empire State Building and the old Police Headquarters building. It is near Little Italy and Chinatown with a subway stop nearby."
usa_new york city_club_quarters_downtown,"I'm sorry, but scenic retreat is not a characteristic mentioned in the reviews. Therefore, I cannot provide a summary."
usa_new york city_club_quarters_midtown,"I am sorry, but the reviews do not contain information about hotels that have scenic retreats."
usa_new york city_club_quarters_rockefeller_center,"The hotel is located across the street from Rockefeller Center and Radio City Music Hall, with some rooms offering views of the ice skating rink, St. Patrick's Cathedral, or Radio City Music Hall. The 7th floor Terrace Club has an outdoor, enclosed patio with views of St. Patrick’s Cathedral, Rockefeller Center, and Radio City."
usa_new york city_comfort_inn_chelsea,Some rooms at the Comfort Inn Chelsea offer views of the Empire State Building. The hotel is near Madison Square Park and the Flatiron Building.
usa_new york city_comfort_inn_manhattan,Some rooms offer views of the Empire State Building and Chrysler Building. Some rooms have windows facing brick walls or air shafts.
usa_new york city_comfort_inn_manhattan_bridge,"Rooms on higher floors offer views of the Manhattan Bridge and the Financial District. The hotel's location in Chinatown provides access to South Street Seaport, the Brooklyn Bridge, and other attractions."
usa_new york city_comfort_inn_midtown,"This hotel does not seem to be a great fit for a scenic retreat, as reviews mention the rooms are small with brick wall views and that there are church bells. However, some rooms on the upper floors have views of the Empire State Building and Chrysler Building."
usa_new york city_comfort_inn_midtown_manhattan,The hotel has rooms on the sixth floor with views of skyscrapers and windows that open. Some rooms have basement locations with potentially poor views.
usa_new york city_comfort_inn_midtown_west_convention_center,"Some rooms on higher floors offer city views, including glimpses of the Empire State Building. One reviewer on the 15th floor loved their view."
usa_new york city_comfort_inn_times_square,"There is no mention of any scenic details, views, or features associated with this hotel. The reviews focus on the location near Times Square and the hotel's value."
usa_new york city_cooper_square_hotel,"The Cooper Square Hotel offers rooms with floor-to-ceiling windows that provide city views, including sights of the Empire State Building and Brooklyn Bridge, and some rooms on higher floors have corner views. Some rooms also have windows that can be opened for fresh air."
usa_new york city_cosmopolitan_hotel_tribeca,"Rooms at the Cosmopolitan Hotel do not offer views, with some rooms facing brick walls or air shafts, though some higher-floor rooms have distant views of the Empire State Building. The area is close to the Brooklyn Bridge and riverfront parks."
usa_new york city_courtyard_by_marriott_new_york_manhattan_times_square_south,"Some rooms on upper floors offer views of the Empire State Building; however, many rooms face adjacent buildings and have limited natural light. The hotel is located near Bryant Park."
usa_new york city_courtyard_by_marriott_new_york_manhattan_upper_east_side,"Some rooms offer views of the East River, and some higher floor rooms have nice city views. It is located near the East River and some parks."
usa_new york city_courtyard_new_york_manhattan_fifth_avenue,The hotel is near Bryant Park and the New York Public Library and some rooms on higher floors have views. Rooms on the non-street side of lower floors have views of brick walls of neighboring buildings.
usa_new york city_courtyard_new_york_manhattan_midtown_east,"Rooms on higher floors offer great views, with some corner rooms on the 26th floor providing views of the Chrysler Building and the East River. The hotel is not located in the heart of the theater or clubbing scene."
usa_new york city_crosby_street_hotel,"The Crosby Street Hotel in Soho features individually designed rooms with tall warehouse-style windows, spacious accommodations, and attention to detail. The hotel also includes a drawing room for afternoon tea."
usa_new york city_crowne_plaza_times_square_manhattan,"The Crowne Plaza Times Square has rooms with views of Times Square, the Hudson River, and the surrounding Manhattan cityscape, with upper floors offering access to a private lounge. Some rooms, particularly corner rooms on higher floors, provide dual-aspect views and spacious accommodations."
usa_new york city_da_vinci_hotel,"I am sorry, but this hotel is located in midtown Manhattan and the reviews do not suggest that this hotel is a scenic retreat."
usa_new york city_doubletree_guest_suites_times_square,"The hotel has rooms on high floors that offer city views, with corner rooms (room numbers ending in ""01"") offering views of Times Square. The 03 rooms offer panoramic views without buildings blocking the view."
usa_new york city_doubletree_hotel_chelsea_new_york_city,Rooms on higher floors offer views of the Empire State Building. Some rooms facing 29th street have a decent view.
usa_new york city_doubletree_metropolitan_hotel,"This hotel is centrally located in midtown Manhattan near subway stations and within walking distance to Central Park, Rockefeller Center, and Times Square. Some rooms have views, and the rooms on higher floors facing away from Lexington Avenue tend to be quieter."
usa_new york city_dream,The hotel has a great rooftop bar with excellent views of Broadway and Times Square. Some rooms on higher floors offer views of Broadway and Times Square.
usa_new york city_duane_street_hotel,"I am sorry, but this hotel is located in a busy area in lower Manhattan and does not seem like it would be a good fit for a scenic retreat. It is close to many attractions and subway lines."
usa_new york city_dylan_hotel,"I am sorry, but the reviews do not contain information relating to a scenic retreat. The hotel has rooms with no view, facing brick walls or office buildings."
usa_new york city_eastgate_tower,The Eastgate Tower offers spacious suites with reflection views of the Chrysler building (from the 24th floor) and of the UN building. Some rooms on higher floors have westward-facing windows with spectacular views.
usa_new york city_econo_lodge_times_square,"I am sorry, but the provided reviews do not contain information about scenic retreats. Therefore, I cannot create a summary based on the query."
usa_new york city_embassy_suites_hotel_new_york_city,"Many rooms offer Hudson river views, some with views of the Statue of Liberty, and the hotel is located on the Waterfront's edge with private walks along the Hudson; construction may obstruct some views. Battery Park is right across the street and has nice walks by the river, especially in the evening to look at the sunsets over New Jersey."
usa_new york city_empire_hotel,"The Empire Hotel is located near Central Park and Lincoln Center, with a rooftop bar offering city views. Some rooms offer views of the opera square or Lincoln Center with the fountain."
usa_new york city_envoy_club,The Envoy Suites has a rooftop deck on the 22nd or 24th floor (depending on the review) with views from the East River to the Manhattan skyline. Some rooms on the corners of the building have glass going right the way around the living area.
usa_new york city_eurostars_wall_street,"I am sorry, but based on the reviews for this hotel, there is no mention of it being a ""scenic retreat"". Instead, the reviews mention that it is located in the Financial District, close to Wall Street, the South Street Seaport, Battery Park, and Ground Zero."
usa_new york city_excelsior_hotel,"The Excelsior Hotel is located on the Upper West Side, across the street from the Museum of Natural History and near Central Park. Some rooms offer park views, with upper floors providing skyline views."
usa_new york city_fairfield_inn_new_york_manhattan_times_square_south,"The hotel's top floor offers wonderful views, although the windows are rather small, and rooms on higher floors facing the street overlook the bus terminal with views of Times Square and the Hudson River. Rooms on the other side of the hotel have closer building views, but may still offer a glimpse of the Empire State Building."
usa_new york city_fitzpatrick_grand_central_hotel,"Rooms on the upper floors may have views of the Chrysler Building, and rooms facing 44th Street offer a city view. Some rooms overlook an outdoor patio."
usa_new york city_fitzpatrick_manhattan,"I'm sorry, but the provided hotel reviews do not contain information about hotels known for their scenic retreats. The reviews focus on the Fitzpatrick Manhattan, discussing its location, staff, rooms, and overall experience, without mentioning any scenic qualities or retreats."
usa_new york city_flatotel,Many reviewers enjoyed the views from higher floors of the hotel. Some reviews mention a gym on the top floor with panoramic city views and rooms with large windows and city views.
usa_new york city_four_points_by_sheraton_manhattan_chelsea,"Rooms on the higher floors facing south have views of downtown, or of the Empire State Building. Some rooms have balconies that offer a shared view."
usa_new york city_four_points_by_sheraton_manhattan_soho_village,"Rooms on the upper floors, particularly those facing south, offer views of the Empire State Building and downtown Manhattan. Some rooms also overlook the Hudson River."
usa_new york city_four_points_by_sheraton_midtown_times_square,"Many rooms on higher floors offer great views of the city skyline. From the 20th floor, guests can enjoy views with no noise, and the 34th floor roof provides views of Jersey and Times Square."
usa_new york city_four_seasons_hotel_new_york,"The Four Seasons in New York offers rooms with views of Central Park and the city, with higher floors providing more expansive scenery. Some suites feature terraces for private outdoor viewing."
usa_new york city_gild_hall,"Gild Hall is located in the Financial District, within walking distance of the Seaport, the Hudson River walkway/park, and Battery Park. It is close to several subway stations making it easy to explore other parts of the city."
usa_new york city_gramercy_park_hotel,"The Gramercy Park Hotel offers a private rooftop terrace with views of New York City, and some rooms have park views overlooking Gramercy Park. The hotel also provides access to the private Gramercy Park for a quiet, green oasis."
usa_new york city_grand_hyatt_new_york,"The Grand Hyatt offers views of the Chrysler Building from some rooms, and is connected to Grand Central Terminal. Some upper floor rooms offer views overlooking 42nd street."
usa_new york city_greenwich_hotel,"The Greenwich Hotel offers a beautiful courtyard, and some rooms feature balconies overlooking it. Select rooms on higher floors offer city views."
usa_new york city_hampton_inn_35th_st_empire_state_building,"The Hampton Inn offers views of the Empire State Building and Macy's from some rooms, particularly those on higher floors. It is located near Herald Square and within walking distance of Times Square."
usa_new york city_hampton_inn_madison_square_garden,"There is no information about scenic retreats for this hotel. It is located close to Penn Station, Madison Square Garden, Times Square, and the Empire State Building."
usa_new york city_hampton_inn_manhattan_chelsea,"Many reviewers on higher floors enjoyed views of the city skyline and the Empire State Building. Some rooms face the backs of other buildings, but are very quiet."
usa_new york city_hampton_inn_manhattan_soho,The Hampton Inn SoHo offers rooms on higher floors with views of the Empire State Building and the Chrysler building. Some rooms have access to a top terrace with city views.
usa_new york city_hampton_inn_manhattan_times_square_south,"Rooms on higher floors offer views, though some rooms may have obstructed views of brick walls; the hotel is a tall, narrow building with six rooms per floor."
usa_new york city_hampton_inn_new_york_seaport_financial_district,"The Hampton Inn Seaport/Financial District is near the Brooklyn Bridge, and rooms on higher floors with street views may offer glimpses of the bridge or tall ships in the Seaport. Some rooms have balconies or patios, and top-floor rooms may have small terraces with views."
usa_new york city_helmsley_middletowne_hotel,Some rooms offer views of the Chrysler Building. It is conveniently located within walking distance to Central Park.
usa_new york city_hilton_club_new_york,"This hotel is located within walking distance of Rockefeller Plaza, Radio City Hall, Broadway shows, and Times Square. Some rooms on the higher floors may offer better views."
usa_new york city_hilton_garden_inn_chelsea,"The hotel offers city views from higher floors, with some rooms providing views of the Empire State Building. It is located in the Flower District, offering a unique street-level atmosphere."
usa_new york city_hilton_garden_inn_new_york_west_35th,The Hilton Garden Inn offers city view rooms with views of the Empire State Building and is centrally located near Times Square. Some rooms on higher floors offer skyline views.
usa_new york city_hilton_garden_inn_times_square,"The Hilton Garden Inn Times Square offers rooms on higher floors with views of 8th Avenue and the Hudson River, though some rooms overlook air-conditioning plants. The hotel's location provides easy access to Times Square, Broadway, and Central Park."
usa_new york city_hilton_garden_inn_tribeca,"I am sorry, but none of the reviews mention a scenic retreat or any scenic views from the hotel besides a review that mentions the view of a neighboring building's airshaft. Some reviews mention a ""Tribeca view"" but it seems this refers to a view down the street."
usa_new york city_hilton_new_york,"The hotel is centrally located in Midtown Manhattan, near Central Park, with some rooms offering views of the park. Rooms on the Executive Level and higher floors offer good views of Central Park and the city."
usa_new york city_hilton_times_square,"Located on 42nd street, the Hilton offers high-floor rooms with views of the Empire State Building, Hudson River, and Times Square. Some rooms have corner views and look out to 41st street."
usa_new york city_holiday_inn_express_new_york_city_fifth_ave,This hotel is not suitable for a scenic retreat as many reviews mention that there are limited to no views. Many rooms face other buildings or alleys.
usa_new york city_holiday_inn_express_new_york_city_times_square,"Rooms on higher floors, such as the 35th, offer amazing views, and some rooms have partial views of the Hudson River. The hotel has 36 floors, with about 4 rooms per floor."
usa_new york city_holiday_inn_express_nyc_madison_square_garden,"I'm sorry, but this hotel is not suitable for a scenic retreat, as the reviews focus on its convenient location in midtown Manhattan and its proximity to transit stations. Rooms also do not have scenic views."
usa_new york city_holiday_inn_manhattan_downtown_soho,"The hotel is located near Chinatown, Little Italy, and Soho, and some rooms on the higher floors have views of the Empire State Building and the Brooklyn Bridge. The Canal Street subway stop is a block away."
usa_new york city_holiday_inn_midtown_57th_st,"The hotel has a pool at the 14th floor with a view over the city, and some rooms on the top floor have amazing views of the city. Some guests recommend rooms overlooking the bay and New York skyline."
usa_new york city_holiday_inn_nyc_manhattan_6th_avenue,"Rooms on higher floors offer views of the Empire State Building and the Manhattan skyline. Some rooms do not have curtains, which can make it difficult to sleep."
usa_new york city_hotel_17,"Hotel 17 is located near several small parks like Gramercy, Stuyvesant & Union Square and is across the street from a nice park. Some rooms have views of the Empire State Building."
usa_new york city_hotel_31,"Hotel 31 offers views of the Empire State Building from some rooms and bathrooms, with a convenient midtown location. The rooms are small and basic, though clean, with shared bathrooms available."
usa_new york city_hotel_373,"Hotel 373 offers views of the Empire State Building from some rooms, particularly on higher floors. The hotel is centrally located on 5th Avenue, near major attractions."
usa_new york city_hotel_41_at_times_square,"I am sorry, the query is unanswerable. The hotel under review is located in Times Square, New York and reviewers consistently mention brick wall views, so it is unlikely to be a scenic retreat."
usa_new york city_hotel_99,"Located on the Upper West Side, Hotel 99 is in a relatively quiet area and a pleasant location. It is situated three blocks away from the subway."
usa_new york city_hotel_beacon,"The Beacon Hotel offers upper-floor rooms with views of Central Park, Riverside Park, the Hudson River, and the Ansonia Building. Some rooms have walk-in closets with windows and there are quiet rooms available overlooking Broadway."
