Hotel,Summary
usa_new york city_hotel_chandler,"This hotel is in midtown Manhattan, near the Empire State Building, with some rooms offering views of it. The hotel's location is near many attractions, but is on a quiet side street and has soundproof rooms."
usa_new york city_hotel_deauville,"The Hotel Deauville offers views of the Empire State Building from some rooms and is within walking distance of mid-Manhattan attractions. Some rooms face brick walls, while others offer street views."
usa_new york city_hotel_east_houston,The hotel has a rooftop terrace with views of the Empire State Building and the city skyline. Corner rooms offer views of the Empire State Building and the Chrysler building.
usa_new york city_hotel_elysee,"Located on a quiet block in midtown Manhattan, Hotel Elysee has rooms facing the street or back with some upper-floor rooms offering terraces. It is conveniently located near Central Park and offers a continental breakfast."
usa_new york city_hotel_gansevoort,"The Gansevoort Hotel offers great views, including Hudson River views from upper floors and a rooftop bar with 360-degree cityscapes. The rooftop pool is also a key feature, providing a spot to relax with views of lower Manhattan and the Hudson River."
usa_new york city_hotel_giraffe,"Hotel Giraffe rooms may have balconies with great views, and it offers a roof top bar with great views of the Empire State Building and Madison Square Park. It is located near Gramercy and Madison Square Park with rooftop access."
usa_new york city_hotel_grand_union,"The hotel's location is near the Empire State Building and some rooms may have views of it. Some rooms have windows that face a brick wall or inner courtyard, resulting in little to no natural daylight."
usa_new york city_hotel_indigo_new_york_city_chelsea,"The hotel is located near the Javits Center, Times Square, Herald Square, and the Meatpacking District and has a rooftop terrace under construction with views over the city. The hotel is located in the Flower District area of Chelsea."
usa_new york city_hotel_mela,"I am sorry, but none of the reviews mention whether the hotel is scenic or not. However, the location is just off Time Square, which is a short walk to Bryant Park, Central Park, and Rockefeller complex."
usa_new york city_hotel_metro,The Hotel Metro has a rooftop bar with views of the Empire State Building. Some rooms also offer views of the Empire State Building.
usa_new york city_hotel_newton,"Hotel Newton is located in the Upper West Side, a short walk to Central Park and Riverside Drive.  Rooms on the upper floors at the back of the hotel offer quiet accommodations."
usa_new york city_hotel_on_rivington,"The Hotel on Rivington is known for offering rooms with floor-to-ceiling windows that provide great views of the Manhattan skyline, the Empire State Building, and the Williamsburg and Brooklyn Bridges. High floor corner rooms with balconies offer the best views."
usa_new york city_hotel_reserve,"I am sorry, but this hotel is not a scenic retreat. This hotel is located in the Financial District, near Wall Street, the NY Stock Exchange, and the WTC site."
usa_new york city_hotel_st_james,"The St. James Hotel is in a great location, close to Times Square and Broadway. The hotel rooms have no view whatsoever."
usa_new york city_hotel_stanford,The hotel rooms either have a view of a brick wall or of the Empire State Building. Some rooms on upper floors are completely quiet.
usa_new york city_hotel_wales,Hotel Wales offers a rooftop terrace with views of Central Park and the reservoir. Some suites offer distant views of Central Park.
usa_new york city_hudson_hotel,The Hudson Hotel has a rooftop terrace and many rooms feature city views. It is located close to Central Park.
usa_new york city_ink48_a_kimpton_hotel,"INK48 is a new hotel that offers rooms with city and Hudson River views; some suites have walls of windows. The hotel is located on 11th Avenue, a short walk from Times Square."
usa_new york city_inn_new_york_city,"Inn New York City is located on a quiet street on the Upper West Side, a few blocks from Central Park and Riverside Park, offering proximity to nature. The Vermont Suite has a patio, and the Opera Suite has a private terrace."
usa_new york city_intercontinental_the_barclay_new_york,"I am sorry, but there is no information about the scenic retreat that you were looking for in this document."
usa_new york city_jumeirah_essex_house,"The Jumeirah Essex House is located across from Central Park and many rooms have park views. Some rooms also have views of the city, and high floor rooms have telescopes."
usa_new york city_kitano_new_york,The Kitano is located in midtown Manhattan and some rooms offer views of the Empire State Building or the Chrysler Building. The hotel is known for being quiet and peaceful.
usa_new york city_la_quinta_manhattan,The La Quinta Inn Manhattan has a rooftop bar with views of the Empire State Building. Some rooms on higher floors may also offer partial views of the Empire State Building.
usa_new york city_lafayette_house,"Lafayette House offers rooms with terraces that open into a courtyard, and rooms with courtyard access. Rooms have sitting areas with fireplaces, and some include kitchenettes."
usa_new york city_le_parker_meridien,"Le Parker Meridien offers a rooftop pool with amazing city views, and some rooms have Central Park views. Some reviewers recommend requesting a Parkview room on a higher floor."
usa_new york city_library_hotel,"The Library Hotel's rooftop bar and lounge offer views of Manhattan skyscrapers, including the Empire State Building, with a Poetry Garden offering a wraparound terrace. Its upper-floor rooms are quiet, and some rooms offer balconies overlooking Madison Avenue."
usa_new york city_loews_regency_hotel,The Loews Regency is located on Park Avenue and some rooms offer views. It is near Central Park which is suitable for morning jogs.
usa_new york city_lowell_hotel,"The Lowell is located near Central Park, with some rooms offering views overlooking The Pierre. Some suites include terraces."
usa_new york city_mandarin_oriental_new_york,"The Mandarin Oriental in New York offers stunning views of Central Park, the Hudson River, and the city skyline from its rooms and lobby lounge, which begins on the 35th floor. Some rooms have unobstructed views while others have partial views obstructed by the Trump Tower."
usa_new york city_milford_plaza_hotel,"I am sorry, but there is no information about the hotel's suitability for a scenic retreat. Most of the reviews focus on its location near Times Square and Broadway, along with mentions of room size, cleanliness, and hotel amenities."
usa_new york city_millenium_hilton,"The Millenium Hilton offers stunning views from upper floors, including corner rooms, with sights of the Hudson River, Statue of Liberty, Brooklyn Bridge, and the WTC construction site. Some rooms have floor-to-ceiling windows to enhance the scenery."
usa_new york city_millennium_hotel_broadway,"The hotel offers rooms with great views, including views of Times Square, the Chrysler Building, and the Empire State Building, and it is close to many attractions, Broadway shows and subway stations. Some rooms have floor-to-ceiling windows."
usa_new york city_millennium_un_plaza_hotel,"The Millennium UN Plaza Hotel offers rooms starting on the 28th floor, with views of the East River, the Manhattan skyline, and landmarks like the Chrysler and Empire State Buildings, and has a pool on the 27th floor with views. Some rooms have large windows, with the top floors offering panoramic views, with east-side views of the East River and west-side views of the New York skyline."
usa_new york city_moderne_hotel,There are no mentions of scenery or retreats at this hotel. Many rooms have no view or a view of a brick wall.
usa_new york city_morgans_hotel,Morgans Hotel offers rooms with views of the Empire State Building and has a roof terrace with city views. Some rooms feature high spire-like ceilings.
usa_new york city_murray_hill_east_suites,"This hotel is near the Empire State Building, and rooms on higher floors may have city views. Some rooms on the ground level have access to a private outdoor garden area."
usa_new york city_murray_hill_inn,"I am sorry, but this hotel is in a city and the reviews do not indicate that this is a good choice for a scenic retreat."
usa_new york city_new_york_marriott_downtown,"The hotel offers excellent views of the Hudson River, Ellis Island, and the Statue of Liberty from upper floors. Some rooms also have views of the Goldman Sachs Tower and the World Trade Center site."
usa_new york city_new_york_marriott_east_side,"This hotel has a fitness center on the 35th floor with views over midtown Manhattan, and some upper floor rooms offer city views, including the Chrysler Building. Some reviewers recommend requesting a high floor or a corner room for better views, while others note construction in the area may cause noise."
usa_new york city_new_york_marriott_marquis,"Located in the heart of Times Square, Marriott Marquis offers astonishing views from upper floors. The View Lounge on the 48th floor provides outstanding rotating views of the city."
usa_new york city_new_york_palace_hotel,"The New York Palace offers rooms with views of St. Patrick's Cathedral, the Rockefeller Center, and the Hudson River from higher floors, including Executive Corner rooms and Tower rooms. Some reviewers recommend requesting a high floor for better views and less street noise."
usa_new york city_night_hotel,"The Night Hotel is not a good fit for a scenic retreat, as rooms are small with no views, or windows facing brick walls, air shafts, or dingy passageways, and is located in the heart of Times Square. The gothic-themed boutique hotel is known for its modern black and white decor and is centrally located near Times Square and Broadway."
usa_new york city_novotel_new_york_times_square,"Many reviewers mention the Novotel's great views of Times Square and Broadway from higher floors, with some recommending requesting a room on the Times Square side or a higher floor for better views. The hotel also features a sky bar and restaurant with outdoor terrace seating offering outstanding views."
usa_new york city_off_soho_suites,"Off Soho Suites offers apartment-like suites with kitchenettes in Lower Manhattan, near Soho, Chinatown, and Little Italy, with subway access. Some suites have windows that open, but noise from a nearby restaurant/bar may be a concern."
usa_new york city_omni_berkshire_place,"The Omni Berkshire Place does not have scenic view rooms, but rooms on higher floors facing 52nd street offer city views; otherwise, rooms may face construction or interior alleyways. Some rooms have balconies and sun decks."
usa_new york city_on_the_ave_hotel,"Some rooms have balconies with views of the Hudson River, Central Park, and the Upper West Side, while the 16th-floor terrace offers city views. The hotel is located on the Upper West Side, near Central Park and Riverside Park."
usa_new york city_park_79_hotel,"Park 79 is located on the Upper West Side, near Central Park and the Museum of Natural History. Some rooms have views overlooking the park or 79th street."
usa_new york city_park_central,"I am sorry, but none of the reviews contain information about scenic retreats. Therefore, I cannot provide a response."
usa_new york city_park_south_hotel,"I am sorry, but this hotel is located in an urban area and the hotel rooms do not have scenic views, with many rooms facing brick walls or noisy streets. However, the hotel is close to a subway and within walking distance of some major attractions, such as the Empire State Building."
usa_new york city_peninsula_new_york,"The Peninsula offers a pool with views of Central Park and 5th Avenue, as well as a rooftop bar with city views. Some rooms on higher floors offer views of Central Park and 5th Avenue."
usa_new york city_phillips_club,"The hotel has suites with impressive views, and is located near Central Park. It is also located near the subway and Lincoln Center."
usa_new york city_plaza_athenee_hotel,"The Plaza Athenee is located on a quiet, tree-lined street on the Upper East Side, close to Central Park, offering a calm area near Madison and Lexington Avenues. Some rooms offer views of the Upper East Side and the city beyond, while others face a brick wall or the roof."
usa_new york city_radisson_martinique_on_broadway,"The hotel is near the Empire State Building and some rooms have a direct view of it. Some rooms have views of Broadway, but other rooms have views of a brick wall."
usa_new york city_ramada_eastside,The hotel is in a good location and rooms on the upper floors offer views of the Chrysler and Empire State buildings. Some rooms facing the street can be noisy.
usa_new york city_red_roof_inn_manhattan,"Located near the Empire State Building, some rooms at the Red Roof Inn have views of the Empire State Building and Chrysler Building. Higher floors are recommended to reduce street noise."
usa_new york city_renaissance_new_york_hotel_57,The hotel offers great views of 57th and Lexington from some rooms and sky loft suites have a huge private terrace with views of surrounding buildings. The location is near Central Park.
usa_new york city_renaissance_new_york_hotel_times_square,"The Renaissance New York Hotel Times Square has a restaurant with an awesome view of Times Square, and the location of the hotel is superb for New Year's Eve celebrations because it overlooks the Times Square ball drop. The Renaissance is in the heart of Times Square and some rooms have great views overlooking Broadway and 7th Avenue."
usa_new york city_residence_inn_by_marriott_times_square_new_york,"The Residence Inn Times Square offers spectacular views of the Empire State Building from its upper floors and corner rooms, with windows that can be opened for fresh air. Some rooms also provide views of Bryant Park, Chrysler Building, and Sixth Avenue."
usa_new york city_ritz_carlton_battery_park,"The Ritz-Carlton Battery Park offers harbor view rooms with telescopes for viewing the Statue of Liberty and Ellis Island, as well as a 14th-floor lounge with harbor views. The hotel's location in Battery Park provides a quiet, scenic environment away from the hustle of Midtown."
usa_new york city_rockefeller_center_hotel,Rooms on higher floors offer views of St. Patrick's Cathedral and Radio City Music Hall. The 7th-floor terrace has views overlooking the Rockefeller Center skating rink with St. Patrick's spires in the background.
usa_new york city_roger_smith_hotel,"I am sorry, but the reviews for this hotel do not contain information about scenic retreats. The reviews mention that it is in midtown Manhattan and close to Grand Central station."
usa_new york city_roger_williams_hotel,"The Roger Williams Hotel is located a few blocks from the Empire State Building, with upper-floor rooms offering views of the building. Some rooms have terraces."
usa_new york city_room_mate_grace,"This hotel has rooms that are not scenic, and are small. The hotel does have a pool with a swim-up bar."
usa_new york city_royalton_hotel_new_york_city,"The Royalton Hotel is centrally located, close to many attractions including Rockefeller Center and Central Park, and some rooms have balconies with views of the New York skyline. It also features fireplaces in some rooms and a lounge area."
usa_new york city_salisbury_hotel,"The Salisbury Hotel is located near Central Park. Some rooms have a street view, and some have rear views."
usa_new york city_san_carlos_hotel,"I'm sorry, but I am unable to confirm if this hotel is suitable for a scenic retreat based on the reviews provided. The hotel is in midtown Manhattan and reviewers highlight the convenient location and spacious rooms."
usa_new york city_seafarers_international_house,"The hotel is located near Union Square, close to shops, bars, restaurants, and the subway. Some rooms have private bathrooms while others have shared bathrooms; there is a free computer with internet in the lobby."
usa_new york city_sheraton_new_york_hotel_towers,"Many reviewers mention phenomenal views, especially from higher floors and club rooms, with some rooms offering views of Times Square, Central Park, and the Hudson River. The hotel's location is also ideal for exploring the city, with easy access to subway lines and walking distance to Times Square and Central Park."
usa_new york city_skyline_hotel,The Skyline Hotel has a pool on the penthouse level with nice views of the Manhattan skyline and the Empire State Building. Rooms facing the front of the hotel may also have views of the Empire State Building.
usa_new york city_smyth_hotel_a_thompson_hotel,"The Smyth Tribeca has rooms with views of West Broadway, Chambers and Hudson Streets, with some rooms also offering views of the Empire State Building. Some rooms have large windows that provide natural light and good views of the surrounding area."
usa_new york city_sofitel_new_york,"The Sofitel New York is located in midtown Manhattan, offering views of the Chrysler Building from rooms on higher floors. Some rooms face the back of other buildings and may not have scenic views."
usa_new york city_soho_grand_hotel,"The Soho Grand Hotel offers north-facing rooms on higher floors (e.g. 16th floor) with views of the Chrysler Building, Empire State Building, and the Manhattan skyline. Some corner rooms also provide views of the Hudson River and the city skyline."
usa_new york city_soho_house_new_york,Soho House New York features a rooftop pool and bar with views of the river and skyline. The hotel is located in the Meatpacking District.
usa_new york city_stay,"I am sorry, but the provided reviews do not mention any scenic retreat elements for this hotel. The hotel is located near Times Square and Broadway."
usa_new york city_the_alex_hotel,"Rooms on higher floors, particularly corner rooms, offer spectacular views of the Chrysler Building and the Manhattan skyline. Some suites have balconies with views of the Chrysler Building and the East River."
usa_new york city_the_belvedere,"The Belvedere Hotel is centrally located in midtown Manhattan, near Times Square, Restaurant Row, and Broadway theaters, and some rooms on the higher floors offer nice views of the city, with executive rooms providing skyline views. The hotel is located on a relatively quiet street, and some rooms face the back of the hotel."
usa_new york city_the_benjamin,Some rooms at The Benjamin have balconies with city views; the higher floors have better views but may still experience street noise. The hotel is located in midtown and within walking distance of many attractions.
usa_new york city_the_blakely_new_york,"I am sorry, but this query is unanswerable. None of the reviews mention a scenic retreat. However, the hotel's location is near Central Park."
usa_new york city_the_bowery_hotel,"The Bowery Hotel offers rooms with floor-to-ceiling windows that provide city views, including the Empire State Building and Chrysler Building; some rooms have soaking tubs with views. The hotel also has a terrace overlooking a garden."
usa_new york city_the_bryant_park,"The Bryant Park Hotel offers park views from many rooms, with some suites featuring balconies overlooking Bryant Park and the NYC Public Library, and is described as a calm and tranquil escape from the city. Some rooms on higher floors offer views of the Empire State Building, and during the winter, guests can view the ice-skating rink in Bryant Park."
usa_new york city_the_carlton,"Many rooms offer views of the Empire State Building, with some reviewers specifically recommending corner rooms for the best views. Rooms facing the inner light shaft have no view, while rooms on the 29th Street side may have noise from the street."
usa_new york city_the_carlyle_a_rosewood_hotel,"The Carlyle offers gorgeous views over the park from its brilliant location, with some rooms featuring a balcony overlooking Madison Avenue. Some rooms on higher floors offer spectacular views of Central Park and the Manhattan skyline."
usa_new york city_the_franklin,"I am sorry, but the reviews for this hotel do not contain information about a scenic retreat or scenery in general."
usa_new york city_the_french_quarters_guest_apartments,"I am sorry, the reviews do not mention if the hotel offers scenic retreats. However, some rooms have balconies, and the hotel is located near Restaurant Row, close to Times Square and Central Park."
usa_new york city_the_gem_hotel_chelsea,"I am sorry, but this hotel is located in the Chelsea neighborhood of Manhattan, New York, and the reviews do not mention any scenic retreat qualities. The reviews focus on the hotel's small rooms, modern design, cleanliness, and convenient location near restaurants and transportation."
usa_new york city_the_gem_hotel_midtown_west,"I am sorry, but the provided reviews do not contain information about hotels that are suitable for a scenic retreat. The reviews focus on the hotel's location in relation to city attractions, room size, cleanliness, and staff friendliness rather than scenic qualities."
usa_new york city_the_gem_hotel_soho,The Gem Soho offers rooms with views of the Sarah Roosevelt Park and is located near the F and V subway lines. Some rooms on upper floors have views over E. Houston St.
usa_new york city_the_grant_hotel,"I am sorry, but based on the reviews, there is no mention of the hotel having scenic views. The reviews mention the hotel's location being close to the subway and some rooms having views of brick walls."
usa_new york city_the_hampton_inn_times_square_north,The Hampton Inn Times Square North offers upper-story rooms with views overlooking 8th Avenue. It is near Central Park and offers some western-facing partial views of the Hudson River.
usa_new york city_the_helmsley_carlton_house,"The hotel is located one block from Central Park, with some rooms offering balconies overlooking the park. Rooms are spacious, with some having sitting areas and kitchenettes."
usa_new york city_the_helmsley_park_lane,"The Helmsley Park Lane is located across the street from Central Park, offering views of the park and city from its rooms, especially those on higher floors. The hotel is located near the subway, 5th Avenue, and other attractions."
usa_new york city_the_herald_square_hotel,"The Herald Square Hotel is not particularly scenic, with many rooms having limited views, such as facing air shafts or the back of other buildings. However, room 918 on the top floor has a tiny outdoor courtyard with a view of the Empire State Building."
usa_new york city_the_hotel_91,"Hotel 91 is located in Manhattan's Chinatown, with some rooms facing the Manhattan Bridge offering views of the traffic/train. Some rooms have skylights, but they may be covered over."
usa_new york city_the_hotel_at_times_square,"I am sorry, but this hotel is in Times Square and there is no mention of a scenic retreat."
usa_new york city_the_inn_at_irving_place,"The Inn at Irving Place is located in a historic 19th-century building and is furnished with antiques. It offers a quiet escape within Manhattan, with features such as fireplaces and a tea service."
usa_new york city_the_iroquois,"This hotel is located close to Times Square, but some rooms have no view while others offer views of the Chrysler Building. Rooms facing the courtyard or back of the hotel tend to be quieter."
usa_new york city_the_jane,"The Jane Hotel is located in the West Village near the Hudson River, with some rooms offering views of the river and skyline. It is also near the High Line Park."
usa_new york city_the_kimberly_hotel,"Many rooms at the Kimberly Hotel feature balconies, and the higher floors offer nice views of the city, including the Chrysler Building and East River. The sunset cruise on the Kimberly yacht is a highlight."
usa_new york city_the_lombardy,"The Lombardy is located near Central Park, and some reviewers mention being able to walk to the park. The hotel's location is central to many attractions in Manhattan."
usa_new york city_the_london_nyc,"Many reviewers mention great views, especially from Vista Suites on higher floors, of Central Park, the Hudson River, and the New York skyline; the location is also convenient to Central Park. Some rooms have bay windows and curved sofas that allow guests to sit comfortably and enjoy the view."
usa_new york city_the_lucerne_hotel,"Rooms on higher floors at The Lucerne offer city views, including uptown and river views, while some rooms facing Amsterdam Avenue have views of street activity. Rooms facing away from Amsterdam Avenue may offer views of brick walls or air shafts."
usa_new york city_the_manhattan_club,"The Manhattan Club's apartments on the corner of the building offer views of Central Park and overlook 7th Ave and 56th Street, with some rooms on higher floors providing views of Central Park. Some rooms may face inward into a central shaft that lets in barely any light, so guests should ensure they book an outward-facing room."
usa_new york city_the_mansfield,"I am sorry, but the provided hotel reviews do not include information about hotels for a scenic retreat. The reviews focus on the Mansfield Hotel, highlighting its central location, room sizes, cleanliness, and staff, but does not mention a scenic retreat."
usa_new york city_the_marcel_at_gramercy,The Marcel has a rooftop terrace with views of the Empire State and Chrysler buildings. Some rooms on corners or higher floors offer dual aspect views of the Empire State Building and 3rd Ave.
