Hotel,Summary
china_beijing_shangri_la_hotel_beijing,"The hotel has multiple restaurants including Blu Lobster for Western cuisine, Nishimura for Japanese cuisine, and Shang Palace for Cantonese cuisine. The restaurants are of a very good standard with vast choices."
china_beijing_shangri_la_kerry_centre_hotel,The Kerry Centre has a huge dining area with a fantastic selection of food for breakfast and dinner with a mix of local and western food selections. There is also a wine bar and cafe.
china_beijing_shatan_hotel,"The hotel restaurant has a Chinese menu with a large selection and a Western menu with burgers and pasta. Some reviewers found the dinner menu lackluster, while others noted that the hotel's restaurant guests were primarily Chinese."
china_beijing_sofitel_wanda_beijing,"The Sofitel Wanda Beijing has multiple well-designed restaurants clustered on the sixth floor, including a Japanese restaurant and a haute cuisine restaurant with excellent service. The hotel offers a varied daily buffet, though some reviewers found the food quality inconsistent with the prices."
china_beijing_soluxe_sunshine_courtyard_hotel,"There is no mention of fine dining at the hotel. Reviews mention local dumpling shops, but no restaurants in the hotel itself."
china_beijing_somerset_zhongguancun,"The hotel offers a daily breakfast lounge, but the breakfast was disappointing with no egg station, no wholemeal bread, only white bread, sad-looking pastries, salad, fried noodles and other bland and oily Chinese food. There are convenience stores and many food joints just round the corner or a street away."
china_beijing_spring_garden_courtyard_hotel,"Breakfast is included, with options for American and Asian foods; guests order the day before. Dumplings are served in the early evening upon request."
china_beijing_sunworld_hotel_beijing,"The hotel has a buffet restaurant on the second floor, as well as a Russian restaurant that serves an international breakfast. There are also two other restaurants and a bar in the hotel, but prices are normal Western prices."
china_beijing_swissotel_beijing,"The hotel has multiple restaurants including a cafe with a breakfast buffet that offers both Asian and European selections. Some reviewers were disappointed by the a la carte menu but enjoyed the dinner buffet, while others found the in-hotel dining options to be over priced."
china_beijing_templeside_deluxe_hutong_house_hotel,"These reviews mention that the hotel does not have a restaurant, but the staff is happy to order food from nearby restaurants for guests, and breakfast is prepared at the hotel. One review mentions having dinner with the owner and staff."
china_beijing_the_aman_at_summer_palace,The hotel offers a room service lunch from the Chinese menu which is superb. It also has a good wine list.
china_beijing_the_emperor,"The hotel has a restaurant that offers a 10 course feast with amazing food presentations, but some of the food was hit or miss. Breakfast has Western choices and an omelet station."
china_beijing_the_opposite_house,"The Opposite House has 2 excellent restaurants, Bei (Asian) and Sureno (Mediterranean), that have received ""Best restaurant of the year"" awards. The hotel also has a Village Café, Mesh Bar, and downstairs bar/club called Punk."
china_beijing_the_peninsula_beijing,"The hotel has two on-site restaurants, Jing and Huang Ting, with Huang Ting recommended for Peking Duck. Jing offers a buffet breakfast and dinner, while Huang Ting serves Cantonese cuisine."
china_beijing_the_regent_beijing,"The Regent has multiple restaurants, including a Chinese restaurant on the 2nd or 3rd floor, and a Bar & Grill restaurant that serves excellent food; there is also an Italian restaurant with gourmet food at gourmet pricing. The hotel also offers a breakfast buffet that includes Chinese, Japanese, and Western selections."
china_beijing_the_ritz_carlton_beijing_financial_street,"The hotel has multiple restaurants including Qi (Chinese), and an Italian restaurant that won awards. However, some reviewers found the food in the main restaurant and Italian restaurant just ok, and suggested eating meals outside the hotel if possible."
china_beijing_the_ritz_carlton_huamao_center,"The hotel has an Italian themed restaurant called 'Barolo' with chef Alexandro, which has won an award. The hotel also offers a creative menu with dishes such as salt encrusted rack of lamb and ahi with truffles."
china_beijing_the_st_regis_beijing,"The hotel has multiple restaurants including Danieli's, an Italian restaurant, and the Celestial Court, a Chinese restaurant with wonderful Peking Duck. Breakfast is a buffet with extensive choices for both Asian and Western cuisine, and the Garden Court is another option for dinner."
china_beijing_the_westin_beijing_chaoyang,"The hotel has a few interesting bars and restaurants, including Grange, a flagship restaurant offering 15 different types of mustard for steak. The Sunday brunch is spectacular, with ample choices."
china_beijing_the_westin_beijing_financial_street,"The hotel has multiple restaurants including Chinese, Italian, and buffet options, with the Chinese restaurant being a hidden gem. Some reviewers mentioned the extensive breakfast buffet with Asian and international cuisine and the Italian restaurant with very good food and fantastic service."
china_beijing_tianlun_dynasty_hotel,"The Sunworld Dynasty Hotel has multiple restaurants including Shanghai style, Hunan style with Peking duck, and an upscale Cantonese restaurant with shark fin soup and abalone. The hotel also has a lovely atrium with a buffet-style restaurant."
china_beijing_tianrui_beijing,"The hotel restaurant serves meals including a breakfast buffet with both Chinese and some Western options, and the restaurant staff is friendly. There is also a dumpling restaurant nearby."
china_beijing_tiantan_hotel,"The Tiantan Hotel has two restaurants including the Rainbow Cafe, which serves a full American/Chinese breakfast buffet. One review mentions a late dinner with noodles, fried rice, and dumplings at the Rainbow Restaurant."
china_beijing_traders_hotel,"The hotel is connected to the China World Hotel, where guests can access additional dining options, and offers an on-site restaurant with a buffet that is fine for breakfast. One reviewer mentioned a good Chinese restaurant (Xiao Wang's Home Restaurant) serving roasted duck within walking distance of the hotel."
china_beijing_traders_upper_east_hotel,"The hotel has above-average food and offers room service. It also features a fully stocked minibar complete with adult beverages, soft drinks, and snack food."
china_beijing_wangfujing_grand_hotel,"The hotel has a restaurant with a large buffet that some reviewers found inedible and expensive, and another next door with great food. Food at the hotel is generally expensive, but there are less expensive restaurants in the area."
china_beijing_xi_jiao_hotel_beijing,"The hotel has several restaurants, including Korean, Japanese, and Izakaya options, but most close early at 8:30 pm, except for a basic but cheap restaurant above the pool/gym that is open to the public. One reviewer mentioned attending a dinner at the hotel a couple of years prior to their stay."
china_beijing_xinhai_jinjiang_hotel,The hotel restaurant is pleasant with a nice selection of standard and local foods. The hotel offers a western-style buffet breakfast with American items on the coffee shop menu.
china_beijing_xinyuan_inn,"The hotel offers breakfast, but the selection is limited. There is a traditional Chinese breakfast restaurant nearby."
china_beijing_xixi_friendship_hotel,The hotel has a Korean restaurant on Level 4 offering an all-you-can-eat buffet and a main restaurant on the 8th floor serving a comprehensive breakfast buffet with Western and Oriental food. Several reviewers mention the presence of restaurants within the building.
china_beijing_xiyuan_hotel,"The Xiyuan Hotel has five restaurants, including a grill room and a revolving restaurant with international buffet meals. The Villa restaurant is reasonably priced, and the hotel has a ""food street"" in a nearby building."
china_beijing_yi_hai_business_hotel,"This hotel does not have fine dining but offers a buffet breakfast for 28RMB. Local restaurants cater to students, with picture menus available."
china_beijing_zhong_an_inn_zhong_an_hotel,The hotel restaurant serves Chinese food and a basic breakfast for 10 yuan. There are also restaurants and a shopping mall across the street.
