Hotel,Summary
china_beijing_oriental_bay_international_hotel,"The Oriental Bay International Hotel is located near a metro station, providing easy access to central Beijing. It is also close to the Temple of Heaven and Ya Show shopping area, and a short taxi ride away from the Olympic stadiums (Bird's Nest & Water Cube)."
china_beijing_oriental_culture_hotel,"The Beijing Oriental Culture Hotel is located close to the Lama Temple and a subway station, making it accessible to various parts of Beijing. It is also near a street with restaurants and a supermarket."
china_beijing_oriental_garden_hotel,The Oriental Garden is a 10-minute taxi ride from Tian'anmen Square and the Forbidden City. It is also a 3-minute walk from the Dongzhimen subway station.
china_beijing_palm_springs_beijing_marriott_executive_apartments,"The Marriott Palm Springs is located a 20-30 minute taxi ride from major attractions, with taxi fares costing approximately £2-3.00. The hotel is located between the third and fourth ring roads across the street from Chaoyang Park, and is not near a subway stop, requiring a taxi to reach it."
china_beijing_park_hyatt_beijing,"The Park Hyatt Beijing is located near the Guomao Station (Lines 1 and 10), providing subway access to the Forbidden City and other attractions, and is within walking distance of the Silk Market. The hotel is situated in the Chaoyang District of Beijing."
china_beijing_park_plaza_beijing_wangfujing,"Park Plaza Beijing Wangfujing is centrally located near the Forbidden City and Tiananmen Square, with easy access to Wangfujing shopping street; Dengshikou subway station is just around the corner. Some rooms offer views of courtyard houses and the Bird's Nest stadium."
china_beijing_peixin_hotel_beijing,The hotel is located about 10-15 minutes by taxi from Tiananmen Square and other major city center sites. It is conveniently located near Hongquiao market and Pearl Shopping Market.
china_beijing_plaza_hotel_beijing,"The hotel is not in the center of town but is a short taxi ride away from attractions like the Forbidden City, Temple of Heaven, and Tiananmen Square. The nearest metro station is a long walk away."
china_beijing_prime_hotel,"The Prime Hotel is located at the north end of Wangfujing shopping street and is within walking distance to the Forbidden City and Tiananmen Square. It is also close to shops, restaurants, and the Dongsi subway station."
china_beijing_pullman_beijing_west_wanda,"The hotel is located a short walk from the subway (Line 1), which provides direct access to major sites like Tiananmen Square and the Forbidden City (20-30 minutes). Taxis to Tiananmen Square cost approximately 45 RMB and take 15-20 minutes."
china_beijing_qianyuan_international_business_hotel,"The hotel is located a 10-15 minute walk from the Dongzhimen metro station, and near the Lama Temple, Confucian Temple, and Imperial Academy. It is located on a busy street with many restaurants."
china_beijing_raffles_beijing_hotel,"The Raffles Beijing is located near Tiananmen Square and the Forbidden City, with the Wangfujing shopping area also within walking distance. The hotel is near a subway entrance and offers easy access to major sights."
china_beijing_renaissance_beijing_capital_hotel,"The hotel is not in the city center but a 20-minute taxi ride away and close to the 3rd Ring Road, with a subway station a 2-minute walk from the hotel. While not within walking distance of the sights, it is located in a newly young chic shopping area, opposite the Fuli Centre shopping mall."
china_beijing_renaissance_beijing_hotel,"The Renaissance Beijing is located a 15-30 minute taxi ride away from major tourist attractions like Tiananmen Square and the Forbidden City, in the northeast part of the city. The hotel is near the embassy district, close to the airport expressway, and offers taxis to the subway for access to downtown."
china_beijing_shangri_la_hotel_beijing,"The Shangri-La Beijing is not conveniently located for tourist attractions, requiring a 30-45 minute taxi ride to reach central sites like Tiananmen Square and the Forbidden City. Taxis are readily available and inexpensive, but the hotel's location is better suited for those needing to be in the western part of Beijing."
china_beijing_shangri_la_kerry_centre_hotel,"The Kerry Centre is near the Silk Market (10-15 minute walk) and a 10 minute taxi ride to the center of Beijing. It's a 5 minute walk to the Guomao subway station, which provides access to the Forbidden City, Tiananmen Square, and the Lama Temple."
china_beijing_shatan_hotel,"Shatan Hotel is located on a hutong, a short walk from the Forbidden City and Jingshan Park, making it a great location for seeing top sites. Some reviewers mention it's within walking distance to Wangfujing shopping street."
china_beijing_sofitel_wanda_beijing,"Some reviews mention the hotel's location is not close to the central attractions, requiring lengthy journeys, while others state it's near the subway, making Tiananmen Square accessible in 10 minutes. Several reviews cite the hotel's proximity to the CBD and financial district."
china_beijing_soluxe_sunshine_courtyard_hotel,"The Soluxe Courtyard Hotel is located close to the Guloudaije subway stop on Line 2, a 10-15 minute walk to the lakes and bar street, and a 5-10 minute walk to the drum and bell tower. It is also located close to a metro station, making Tiananmen Square and the Forbidden City accessible by metro or taxi."
china_beijing_somerset_zhongguancun,"Somerset ZhongGuanCun is located in the Haidian district and is a 15-minute ride from the Summer Palace, with convenient access to subway line 10 for travel to other attractions like the Olympic Park. However, it is further from Chaoyang, where major malls and entertainment are located, requiring a longer subway ride or a 40 RMB taxi fare."
china_beijing_spring_garden_courtyard_hotel,"The Spring Garden Courtyard Hotel is located in a hutong (traditional Beijing alley) and is reasonably close to the Forbidden City and Behai Gardens (though taxi transport is still needed). The hotel is near shops, restaurants, and a Bank of China, and is within walking distance of BeiHai Park and close to bus lines that go to Tiananmen Square and the zoo/aquarium."
china_beijing_sunworld_hotel_beijing,"The Sunworld Hotel (formerly Tianlun Songhe Hotel) is located near Wangfujing Street, within walking distance of the Forbidden City and Tiananmen Square. The hotel is also close to the metro and has restaurants and supermarkets nearby."
china_beijing_swissotel_beijing,"The Swissotel Beijing is near a subway station, making access to Beijing attractions easy, and is also close to the Workers Stadium. Some reviewers mention the hotel's proximity to the San Li Tun bar district, Ya Show clothing market, Houhai Park, Beihei Park and the Forbidden City."
china_beijing_templeside_deluxe_hutong_house_hotel,"Templeside Deluxe Hutong House is located in a traditional Hutong neighborhood, about a 10-15 minute walk to the nearest subway station, with easy access to taxis on the main road. The hotel staff can provide directions and assistance with transportation."
china_beijing_the_aman_at_summer_palace,The Aman Summer Palace has a private entrance to the Summer Palace. It is located about 45 minutes from the heart of Beijing.
china_beijing_the_emperor,The Emperor Hotel is located next to the Forbidden City and within walking distance of many of Beijing’s historic attractions. Some rooms have views of the Forbidden City's rooftops.
china_beijing_the_opposite_house,The Opposite House is not within walking distance to the center of town but is closer to the pearl market than other hotels. It is located in Sanlitun in the Chaoyang district.
china_beijing_the_peninsula_beijing,"The Peninsula is located near the Forbidden City, a pedestrian mall and a subway stop. It is within walking distance of the Forbidden City, Tienanmen Square, and the main shopping areas."
china_beijing_the_regent_beijing,"The Regent Beijing is located near the Forbidden City, Tiananmen Square, and Wangfujing shopping area; it is also conveniently located next to a subway station. Some rooms offer views of the Forbidden City."
china_beijing_the_ritz_carlton_beijing_financial_street,"The hotel is located a cab ride away from Beijing's landmarks, such as Tianenmen Square, the Forbidden City, Wangfujie Dajie, and the Silk Market, but is not within walking distance to a subway station. While the location is in the business district, taxis are readily available and inexpensive, with the most expensive fare being RMB25 to the Temple of Heaven."
china_beijing_the_ritz_carlton_huamao_center,"The Ritz-Carlton Beijing is located in the Chaoyang District, near the Dawanglu subway stop, about 20 minutes by car from the Forbidden City and Tiananmen Square. While some found the location less convenient for tourist sights compared to hotels in the Wangfujiang area, the subway access provides an alternative to taxis."
china_beijing_the_st_regis_beijing,The St. Regis Beijing is near the embassy area and is a 30-minute walk or a short cab ride to Tienanmen Square. The hotel is also a 5-10 minute walk to the subway and within walking distance of the Silk Market.
china_beijing_the_westin_beijing_chaoyang,"The hotel is located near a metro stop, which provides simple reliable transport to different parts of the city, and is close to Sanlitun by taxi. The hotel is located opposite the Lufthansa centre and near lots of other large hotels."
china_beijing_the_westin_beijing_financial_street,"The Westin Beijing Financial Street is not located near the main tourist sites, but it is a short taxi ride away from attractions such as Tiananmen Square and the Forbidden City; the subway station is a 5-15 minute walk from the hotel. Taxis are readily available and cheap."
china_beijing_tianlun_dynasty_hotel,"The Tianlun Dynasty Hotel (later known as Sunworld Dynasty Hotel) is located near the Forbidden City, Tiananmen Square, and Wangfujing shopping street. Many reviewers mention the hotel's central location, making it convenient for walking to major attractions and accessing shopping and dining options."
china_beijing_tianrui_beijing,"The Tian Rui Hotel is located off Wangfujing Street, close to the night market and a subway station (line 5). It's situated in a quiet hutong, offering access to both tourist areas and traditional Beijing life."
china_beijing_tiantan_hotel,The Tiantan Hotel is near the Temple of Heaven (20-minute walk) and Pearl Market (10-minute walk). It is a 15-30 minute cab ride to other sites.
china_beijing_traders_hotel,"Traders Hotel is close to the Metro, Silk Market, and Forbidden City. It is located atop a subway stop on line 1, from which one can easily get to Tiananmen Square and other tourist sites."
china_beijing_traders_upper_east_hotel,"The Traders Upper East hotel is located in the ""new"" business district, about halfway between the Beijing airport and the center of the city, but quite far from tourist attractions and not near a subway station. The hotel caters to business travelers."
china_beijing_wangfujing_grand_hotel,"The Wangfujing Grand Hotel is located near the Forbidden City and Wangfujing shopping street, making it convenient for sightseeing and shopping. Some rooms offer views of the Forbidden City, and it's within walking distance of major attractions and has easy access to taxis, buses, and trams for exploring the city."
china_beijing_xi_jiao_hotel_beijing,"This hotel is located near university sites such as Tsinghua and Peking University, accessible via the WuDaoKou subway station which connects to the airport express and other parts of the city. Taxis are readily available at the hotel entrance for transportation."
china_beijing_xinhai_jinjiang_hotel,"The Xinhai Jinjiang Hotel is within walking distance to the Forbidden City (15 minutes), Tiananmen Square (25 minutes), and Wangfujing shopping district (10 minutes). It is also located near subway stations and has taxis readily available."
china_beijing_xinyuan_inn,Xinyuan Inn is located within reasonable walking distance of many sights and has good bus access for short hops to sights and the subway; the subway is also accessible via a 15-20 minute walk. The hotel is located in a modern and touristy hutong.
china_beijing_xixi_friendship_hotel,"The XiXi Youyi Hotel is located about a mile west of Tiananmen Square and a 10-minute walk from the Xidan subway station on Line 1, which is a main shopping district. It is not far from many tourist spots by taxi and underground."
china_beijing_xiyuan_hotel,The Xiyuan Hotel is located across the street from the zoo and about a 20-minute cab ride to the center of town. It is not well-located for tourism and far away from the central city where most tourist attractions are located.
china_beijing_yi_hai_business_hotel,"The hotel is located in Haidan (University District) and is a 5-minute taxi or 7-8 minute bus ride to the XiZhiMen Underground station, which provides access to central Beijing. Commuting to central Beijing takes about 30 minutes."
china_beijing_zhong_an_inn_zhong_an_hotel,"Zhong An Hotel is conveniently located near the Beijing Railway Station and subway, making it easy to access attractions like Tiananmen Square and the Forbidden City. Some rooms have computers with free internet, and the hotel offers affordable tours to the Great Wall and other sites."
