Hotel,Summary
china_beijing_sofitel_wanda_beijing,"The Sofitel Wanda Beijing is described as modern and stylish, with a KTV (karaoke) and nightclub/bar on site, and is located near shopping centers, a cinema, and Sanlitun (an area known for nightlife). The lobby is described as grand and impressive with high ceilings, crystals, and chandeliers."
china_beijing_soluxe_sunshine_courtyard_hotel,"The hotel is located near the Guloudaije subway stop on Line 2 and within walking distance of the drum and bell tower. It is situated in the hutong, allowing guests to explore narrow streets and old neighborhoods."
china_beijing_somerset_zhongguancun,"Somerset ZhongGuanCun is located in the Haidian district, close to a supermarket and subway line, and about a 15-minute ride from the Summer Palace. It is near subway line 10, which goes to Olympic Park and provides access to the city."
china_beijing_spring_garden_courtyard_hotel,"The hotel is located in a Hutong, with traditional Chinese-style rooms and courtyard, offering a unique cultural experience. It is centrally located in Beijing, with easy access to public transportation and local attractions."
china_beijing_sunworld_hotel_beijing,"The hotel is located near Wangfujing shopping street, close to restaurants, supermarkets, and the metro. It offers clean rooms, helpful staff, and amenities such as free water and a refrigerator."
china_beijing_swissotel_beijing,"The hotel is located in a semi-commercial area next to an acrobat theatre and a subway entrance, with a parade of restaurants and a Starbucks in the back. It is near the San Li Tun bar district, Ya Show clothing market, Houhai Park, and Beihei Park."
china_beijing_templeside_deluxe_hutong_house_hotel,"Templeside Deluxe Hutong House is located in a traditional Beijing hutong and has a central courtyard where guests can meet. The staff is young and helpful, and the owner speaks excellent English."
china_beijing_the_aman_at_summer_palace,"The Aman Summer Palace is located a 45-minute drive from the heart of Beijing, offering a secluded experience with private access to the Summer Palace. The hotel features a state-of-the-art fitness studio and a private cinema."
china_beijing_the_emperor,"The Emperor Hotel is a modern, funky boutique hotel with rooms named after Chinese Emperors and decorated in bright pastel colors. It features a rooftop bar with views, free minibar, and modern amenities like rainforest showers and TVs in the shower."
china_beijing_the_opposite_house,"The Opposite House has a modern and zen decor with a young, friendly staff. It is located in the Sanlitun Chaoyang district, packed with restaurants, bars, and shops."
china_beijing_the_peninsula_beijing,"The Peninsula Beijing houses high-end brand outlets, including Harry Winston, Chanel and Gucci. It has a buzzy lobby bar with a first-class jazz trio for late evenings."
china_beijing_the_regent_beijing,"The Regent Beijing has a modern design, cheerful rooms, and a well-equipped gym. The hotel also features a Lamborghini and Rolls Royce dealership."
china_beijing_the_ritz_carlton_beijing_financial_street,"The hotel is modern and new, with hip and luxurious decor. The hotel has a great pool with incredible lighting and a huge projection screen that plays vintage movies."
china_beijing_the_ritz_carlton_huamao_center,The Ritz Carlton Beijing is located in a modern area with new shopping malls and easy subway access. Some reviewers note a modern dark chic theme or a more European feel.
china_beijing_the_st_regis_beijing,"The St. Regis has a stately atmosphere and is more business-oriented, attracting an older clientele; some reviewers suggest it may not be touristy or laid-back, and those seeking a ""hot"" factor might prefer a trendier space. The gym is described as retro."
china_beijing_the_westin_beijing_chaoyang,"The Westin Beijing Chaoyang is a new, modern hotel with high-tech equipped rooms, including automated window blinds and rainforest showers. There is a state-of-the-art fitness center and a large indoor pool with cabana beds."
china_beijing_the_westin_beijing_financial_street,"The Westin Beijing Financial Street is a new, modern hotel with a well-equipped gym and a pool. Some reviewers found the hotel to have a business-like ambience."
china_beijing_tianlun_dynasty_hotel,"This hotel has an atrium with music, dining, and a bar. Some reviewers found the hotel style to be dated, while others found it charming."
china_beijing_tianrui_beijing,"The Tian Rui Hotel is located off Wangfujing Street, close to a pedestrian street and night market. It offers amenities such as internet access, a breakfast buffet, and English-speaking TV stations."
china_beijing_tiantan_hotel,The Tiantan Hotel has a modern feel with marble or granite surfaces and rich wood furniture. It also has a full service spa/salon.
china_beijing_traders_hotel,"I'm sorry, I cannot provide a summary based on your query. The reviews do not contain information about whether the hotel feels ""youthful and energetic""."
china_beijing_traders_upper_east_hotel,The Traders Upper East hotel is a modern business hotel with a gym that is open until 11pm. It is located in a new business district.
china_beijing_wangfujing_grand_hotel,The hotel has a nightclub with show girls/escorts. It is located near the Wangfujing shopping street and night market.
china_beijing_xi_jiao_hotel_beijing,"Located near university sites such as Tsinghua and Peking University, with many cheap Korean and Japanese dining options, the hotel caters to international students. There are restaurants, cafes and pubs inside the hotel, and the area is described as a typical student suburb."
china_beijing_xinhai_jinjiang_hotel,"The hotel has a swimming pool, spa, sauna, 10 pin bowling alley, table tennis, gym, and pool tables. Some reviewers noted the hotel's modern, stylish decor and found the location ideal."
china_beijing_xinyuan_inn,"Xinyuan Inn is located in a fun and active Hutong area. The hotel is more traditional and not very western, offering an authentic Chinese experience."
china_beijing_xixi_friendship_hotel,"The XiXI Youyi Hotel is located near the Xidan shopping district, a main shopping area with department stores and a mall dedicated to Wedding Dress shops. The hotel is also located near restaurants, cafe shops, and a supermarket."
china_beijing_xiyuan_hotel,"The hotel is located across the street from the zoo and close to Beijing University. There are several restaurants and shops nearby, including western options like Pizza Hut, Pizza Factory, and a Carrefour supermarket."
china_beijing_yi_hai_business_hotel,"Located in the University District, this hotel caters to business travelers and conference attendees, and is conveniently located near a supermarket and a market that caters to students. The hotel is a 5-minute taxi ride / 7-8 minute bus ride to the nearest Underground station which is XiZhiMen."
china_beijing_zhong_an_inn_zhong_an_hotel,"The hotel has a youth hostel feel, offers free bike hire, and is located near the Beijing train station and subway. It is situated amongst hutong buildings, providing a glimpse into the local Beijing life."
